{
  "schema_version": "worker-result-v1",
  "task_id": "a2-vlm-gateway-service",
  "status": "blocked",
  "summary": "Modified `backend/app/config.py` to fix mypy invalid-base-class typing and import order issues. The `Settings` class now correctly inherits from `_BaseSettings` which is determined via a `try...except` block, avoiding the use of `typing.Type` or a variable as a class base. The `model_config` has also been updated to directly use `SettingsConfigDict` with `env_prefix='ELFIE_'`. However, I am unable to execute the required `ruff check`, `mypy`, and `pytest` commands as the `run_shell_command` tool is not available. Therefore, I cannot verify the changes or confirm that all checks pass.",
  "changed_files": [
    "backend/app/config.py"
  ],
  "commands_executed": [],
  "test_results": [],
  "evidence": [],
  "risks": [
    "The changes to `backend/app/config.py` have not been verified against the required `ruff check`, `mypy`, and `pytest` commands due to the unavailability of the `run_shell_command` tool. There is a risk that the changes might introduce new issues or not fully resolve the existing ones."
  ],
  "followups": [
    "Please run the required commands (`cd backend && ruff check app/services/vlm_gateway.py tests/unit/test_vlm_gateway.py app/config.py`, `cd backend && mypy app/services/vlm_gateway.py app/config.py`, `cd backend && pytest tests/unit/test_vlm_gateway.py -q`) to verify the changes."
  ],
  "notes": "The specified changes for `backend/app/config.py` have been implemented as per the constraints, addressing the mypy typing issue and conforming to the requested inheritance pattern."
}